{
  "title": "چراغ اضطراری کم‌ولتاژ",
  "summary": "یک چراغ اضطراری ساده با باتری قابل شارژ و آرایه LED — مناسب برای قطعی برق",
  "description": "چراغ اضطراری کم‌ولتاژ با باتری قابل شارژ و ماژول شارژ USB. هنگام قطعی برق به‌طور خودکار روشن می‌شود و هنگام وصل‌شدن برق از طریق USB شارژ می‌شود. مناسب برای اتاق، راهرو یا کمپینگ.",
  "category": "lighting",
  "difficulty": "beginner",
  "safetyLevel": "LOW",
  "estimatedMinutes": 45,
  "skills": ["لحیم‌کاری پایه", "سیم‌کشی پایه", "نگهداری باتری"],
  "parameters": [
    {
      "key": "ledCount",
      "label": "تعداد LED",
      "type": "integer",
      "min": 1,
      "max": 5,
      "step": 1,
      "default": 3
    },
    {
      "key": "batteryCapacity",
      "label": "ظرفیت باتری",
      "type": "enum",
      "default": "1200mAh",
      "options": [
        { "value": "600mAh", "label": "۶۰۰ میلی‌آمپر ساعت" },
        { "value": "1200mAh", "label": "۱۲۰۰ میلی‌آمپر ساعت" }
      ]
    }
  ],
  "components": [
    {
      "logicalPartId": "LED-5MM-WHITE",
      "role": "Required",
      "qtyFormula": "ledCount",
      "alternatives": ["LED-5MM-WARMWHITE"],
      "notes": "LED ۵ میلی‌متری سفید برای نور اضطراری"
    },
    {
      "logicalPartId": "BATT-LIPO-RECHARGEABLE",
      "role": "Required",
      "qtyFormula": "1",
      "notes": "باتری قابل شارژ لیتیومی با ظفیت انتخابی — مناسب برای تغذیه LED"
    },
    {
      "logicalPartId": "CHARGE-MODULE-USB",
      "role": "Required",
      "qtyFormula": "1",
      "notes": "ماژول شارژ USB با مدیریت شارژ — ولتاژ شارژ ۵ ولت"
    },
    {
      "logicalPartId": "SWITCH-SPDT",
      "role": "Required",
      "qtyFormula": "1",
      "notes": "کلید سه‌حالته: روشن / خودکار / خاموش"
    },
    {
      "logicalPartId": "RES-100",
      "role": "Required",
      "qtyFormula": "ledCount",
      "notes": "مقاومت ۱۰۰ اهم برای هر LED — محاسبه بر اساس ولتاژ باتری (NEEDS ENGINEERING REVIEW)"
    },
    {
      "logicalPartId": "ENCLOSURE-PLASTIC",
      "role": "Required",
      "qtyFormula": "1",
      "notes": "قاب پلاستیکی با پایه برای نصب دیواری یا رومیزی"
    }
  ],
  "tools": ["هویه", "سیم‌چین", "پیچ‌گوشتی"],
  "steps": [
    {
      "n": 1,
      "title": "آماده‌سازی آرایه LED",
      "description": "تعداد LED مورد نیاز را با مقاومت‌های ۱۰۰ اهم به‌صورت موازی به هم وصل کنید. هر LED با یک مقاومت سری متصل شود.",
      "safety": "جهت قرارگیری LEDها را یکسان نگه دارید تا اتصال معکوس رخ ندهد."
    },
    {
      "n": 2,
      "title": "اتصال ماژول شارژ به باتری",
      "description": "پایه‌های مثبت و منفی باتری را به ماژول شارژ USB وصل کنید. مطمئن شوید قطب‌ها صحیح هستند.",
      "safety": "هرگز قطب‌های باتری را اشتباه وصل نکنید؛ ممکن است باتری آسیب ببیند."
    },
    {
      "n": 3,
      "title": "اتصال کلید و آرایه LED",
      "description": "خروجی ماژول شارژ را از طریق کلید به آرایه LED وصل کنید. کلید را به‌گونه‌ای سیم‌بندی کنید که حالت‌های روشن/خودکار/خاموش را پشتیبانی کند.",
      "safety": "اتصالات لحیم را با نوار چسب برق یا هیت‌شرینک ایزوله کنید."
    },
    {
      "n": 4,
      "title": "نصب در قاب",
      "description": "تمام اجزا را در قاب پلاستیکی نصب کنید. باتری و ماژول شارژ را در پایین و LEDها را در بالای قاب قرار دهید. پورت USB شارژ را در دسترس بگذارید.",
      "safety": "مطمئن شوید باتری محکم نصب شده و احتمال اتصال کوتاه وجود ندارد."
    },
    {
      "n": 5,
      "title": "تست نهایی",
      "description": "باتری را شارژ کنید، سپس کلید را در حالت روشن قرار دهید. مدت زمان روشنایی را اندازه بگیرید. سپس حالت خودکار را تست کنید: با قطع USB باید چراغ روشن شود.",
      "safety": "در صورت گرم‌شدن باتری یا ماژول شارژ، فوراً مدار را جدا کنید."
    }
  ],
  "tests": [
    { "name": "روشن‌شدن LED با باتری", "expected": "آرایه LED با روشنایی یکنواخت روشن شود" },
    { "name": "شارژ از طریق USB", "expected": "چراغ هنگام اتصال USB خاموش شود و ماژول شارژ نشانگر شارژ را نشان دهد" },
    { "name": "روشن‌شدن خودکار هنگام قطع USB", "expected": "با جداکردن کابل USB، چراغ به‌طور خودکار روشن شود" }
  ],
  "safetyWarnings": [
    "باتری‌های لیتیومی قابل شارژ را در برابر اتصال کوتاه، حرارت بالا و شارژ بیش از حد محافظت کنید.",
    "هرگز باتری را بدون نظارت شارژ نکنید.",
    "از ماژول شارژ با مدیریت شارژ مناسب استفاده کنید تا از شارژ بیش از حد جلوگیری شود.",
    "در صورت بادکردگی یا نشتی باتری، فوراً استفاده را متوقف کنید."
  ],
  "license": "CC-BY-NC-4.0",
  "authorId": "besaz-team",
  "reviewerIds": ["besaz-team"]
}
